<?xml version="1.0" encoding="UTF-8"?>

<langileak xmlns:xsi="http://www.w3.org/2001/XMLSchema-instance"
           xsi:noNamespaceSchemaLocation="erronka2.xsd">

    <!-- BULEGARIA -->
    <langilea mota="bulegaria" idLangile="12345678">
        <izena>Jon</izena>
        <abizena>Etxeberria</abizena>
        <emaila>jon.etxeberria@example.com</emaila>
        <telefonoa>600123456</telefonoa>
        <data>2024-03-15</data>

        <nagusia idNagusi="87654321">
            <izena>Ane</izena>
            <abizena>Perez</abizena>
        </nagusia>

        <bulegariDatuak>
            <lanpostua idLanpostu="1">Administratzailea</lanpostua>
        </bulegariDatuak>
    </langilea>


    <!-- SALTZAILEA -->
    <langilea mota="saltzailea" idLangile="23456789">
        <izena>Maite</izena>
        <abizena>Cuesta</abizena>
        <emaila>maite.cuesta@example.com</emaila>
        <telefonoa>611987654</telefonoa>
        <data>2023-09-01</data>

        <saltzaileDatuak>
            <erabiltzailea>mcuesta</erabiltzailea>
            <pasahitza>123</pasahitza>
        </saltzaileDatuak>
    </langilea>

</langileak>